{
  "schema_version": 3,
  "input": "そしてなによりも",
  "tokens": [
    {
      "id": "token-0",
      "surface": "そして",
      "pos1": "接続詞",
      "pos2": "",
      "pos3": "",
      "pos4": "",
      "conj_type": "",
      "conj_form": "",
      "base_form": "そして",
      "reading": "そして",
      "furigana": [
        {
          "text": "そして",
          "reading": null
        }
      ],
      "byte_start": 0,
      "byte_end": 9,
      "position": 0,
      "glosses": [
        {
          "entry_seq": 1006730,
          "gloss": "and; and then; thus; and now; and finally",
          "pos": [
            "Conjunction"
          ]
        }
      ]
    },
    {
      "id": "token-1",
      "surface": "なに",
      "pos1": "代名詞",
      "pos2": "",
      "pos3": "",
      "pos4": "",
      "conj_type": "",
      "conj_form": "",
      "base_form": "何",
      "reading": "なに",
      "furigana": [
        {
          "text": "なに",
          "reading": null
        }
      ],
      "byte_start": 9,
      "byte_end": 15,
      "position": 1,
      "glosses": [
        {
          "entry_seq": 1577100,
          "gloss": "what",
          "pos": [
            "Pronoun"
          ]
        },
        {
          "entry_seq": 1577100,
          "gloss": "you-know-what; that thing",
          "pos": [
            "Pronoun"
          ]
        },
        {
          "entry_seq": 1577100,
          "gloss": "whatsit; whachamacallit; what's-his-name; what's-her-name",
          "pos": [
            "Pronoun"
          ]
        },
        {
          "entry_seq": 1577100,
          "gloss": "(not) at all; (not) in the slightest",
          "pos": [
            "Adverb"
          ]
        },
        {
          "entry_seq": 1577100,
          "gloss": "what?; huh?",
          "pos": [
            "Interjection"
          ]
        },
        {
          "entry_seq": 1577100,
          "gloss": "hey!",
          "pos": [
            "Interjection"
          ]
        }
      ]
    },
    {
      "id": "token-2",
      "surface": "より",
      "pos1": "助詞",
      "pos2": "格助詞",
      "pos3": "",
      "pos4": "",
      "conj_type": "",
      "conj_form": "",
      "base_form": "より",
      "reading": "より",
      "furigana": [
        {
          "text": "より",
          "reading": null
        }
      ],
      "byte_start": 15,
      "byte_end": 21,
      "position": 2,
      "glosses": [
        {
          "entry_seq": 1013190,
          "gloss": "than",
          "pos": [
            "Particle"
          ]
        },
        {
          "entry_seq": 1013190,
          "gloss": "from; out of; since; at; on",
          "pos": [
            "Particle"
          ]
        },
        {
          "entry_seq": 1013190,
          "gloss": "except; but; other than",
          "pos": [
            "Particle"
          ]
        }
      ]
    },
    {
      "id": "token-3",
      "surface": "も",
      "pos1": "助詞",
      "pos2": "係助詞",
      "pos3": "",
      "pos4": "",
      "conj_type": "",
      "conj_form": "",
      "base_form": "も",
      "reading": "も",
      "furigana": [
        {
          "text": "も",
          "reading": null
        }
      ],
      "byte_start": 21,
      "byte_end": 24,
      "position": 3,
      "glosses": [
        {
          "entry_seq": 2028940,
          "gloss": "too; also; in addition; as well; (not) either (in a negative sentence)",
          "pos": [
            "Particle"
          ]
        },
        {
          "entry_seq": 2028940,
          "gloss": "both A and B; A as well as B; neither A nor B (in a negative sentence)",
          "pos": [
            "Particle"
          ]
        },
        {
          "entry_seq": 2028940,
          "gloss": "even; as much as; as many as; as far as; as long as; no less than; no fewer than",
          "pos": [
            "Particle"
          ]
        },
        {
          "entry_seq": 2028940,
          "gloss": "even if; even though; although; in spite of",
          "pos": [
            "Particle"
          ]
        }
      ]
    }
  ],
  "primary_matches": [
    {
      "id": "match-0-0",
      "rule_name": "そして、～",
      "jlpt": "N5",
      "meaning_en": "Used to connect two sentences; 'and then', 'and'.",
      "hint": "Sentence 1 + そして + Sentence 2",
      "sense_id": "hanabira-n5-083",
      "ambiguity_group": null,
      "captures": [],
      "token_start": 0,
      "token_end": 0,
      "score": {
        "fallback": false,
        "priority": 0,
        "span_length": 1,
        "core_specificity": 1,
        "context_specificity": 0,
        "wildcard_steps": 2,
        "optional_steps": 0
      },
      "provenance": [
        {
          "source": {
            "id": "hanabira",
            "label": "Hanabira"
          },
          "rule_id": "hanabira-n5-083",
          "variant_id": "formation-01"
        }
      ]
    },
    {
      "id": "match-1-3",
      "rule_name": "何より",
      "jlpt": "N2",
      "meaning_en": "Above all else, more than anything",
      "hint": null,
      "sense_id": "test-local-nani-yori",
      "ambiguity_group": null,
      "captures": [],
      "token_start": 1,
      "token_end": 3,
      "score": {
        "fallback": false,
        "priority": 0,
        "span_length": 3,
        "core_specificity": 3,
        "context_specificity": 0,
        "wildcard_steps": 0,
        "optional_steps": 1
      },
      "provenance": [
        {
          "source": {
            "id": "local",
            "label": "Local catalog"
          },
          "rule_id": "test-local-nani-yori",
          "variant_id": "kana"
        }
      ]
    }
  ],
  "secondary_matches": [
    {
      "id": "secondary-1-2-0",
      "matched": {
        "id": "match-1-2",
        "rule_name": "何より",
        "jlpt": "N2",
        "meaning_en": "Above all else, more than anything",
        "hint": null,
        "sense_id": "test-local-nani-yori",
        "ambiguity_group": null,
        "captures": [],
        "token_start": 1,
        "token_end": 2,
        "score": {
          "fallback": false,
          "priority": 0,
          "span_length": 2,
          "core_specificity": 2,
          "context_specificity": 0,
          "wildcard_steps": 0,
          "optional_steps": 1
        },
        "provenance": [
          {
            "source": {
              "id": "local",
              "label": "Local catalog"
            },
            "rule_id": "test-local-nani-yori",
            "variant_id": "kana"
          }
        ]
      },
      "reason": "contained_by_stronger_match",
      "blocked_by": "match-1-3"
    },
    {
      "id": "secondary-3-3-0",
      "matched": {
        "id": "match-3-3",
        "rule_name": "誰か・どこか・誰も・どこも",
        "jlpt": "N5",
        "meaning_en": "Someone, somewhere, not anyone, not anywhere",
        "hint": null,
        "sense_id": "test-local-broad-mo",
        "ambiguity_group": null,
        "captures": [],
        "token_start": 3,
        "token_end": 3,
        "score": {
          "fallback": false,
          "priority": 0,
          "span_length": 1,
          "core_specificity": 1,
          "context_specificity": 2,
          "wildcard_steps": 0,
          "optional_steps": 0
        },
        "provenance": [
          {
            "source": {
              "id": "local",
              "label": "Local catalog"
            },
            "rule_id": "test-local-broad-mo",
            "variant_id": "particle-mo"
          }
        ]
      },
      "reason": "contained_by_stronger_match",
      "blocked_by": "match-1-3"
    }
  ],
  "tree": {
    "root_id": "document-0",
    "nodes": [
      {
        "id": "document-0",
        "kind": "document",
        "token_start": 0,
        "token_end": 3,
        "token_id": null,
        "match_ids": [],
        "secondary_match_ids": []
      },
      {
        "id": "sentence-0",
        "kind": "sentence",
        "token_start": 0,
        "token_end": 3,
        "token_id": null,
        "match_ids": [],
        "secondary_match_ids": []
      },
      {
        "id": "bunsetsu-0-0",
        "kind": "bunsetsu",
        "token_start": 0,
        "token_end": 0,
        "token_id": null,
        "match_ids": [
          "match-0-0"
        ],
        "secondary_match_ids": []
      },
      {
        "id": "token-0",
        "kind": "token",
        "token_start": 0,
        "token_end": 0,
        "token_id": "token-0",
        "match_ids": [],
        "secondary_match_ids": []
      },
      {
        "id": "bunsetsu-0-1",
        "kind": "bunsetsu",
        "token_start": 1,
        "token_end": 3,
        "token_id": null,
        "match_ids": [
          "match-1-3"
        ],
        "secondary_match_ids": [
          "secondary-1-2-0",
          "secondary-3-3-0"
        ]
      },
      {
        "id": "token-1",
        "kind": "token",
        "token_start": 1,
        "token_end": 1,
        "token_id": "token-1",
        "match_ids": [],
        "secondary_match_ids": []
      },
      {
        "id": "token-2",
        "kind": "token",
        "token_start": 2,
        "token_end": 2,
        "token_id": "token-2",
        "match_ids": [],
        "secondary_match_ids": []
      },
      {
        "id": "token-3",
        "kind": "token",
        "token_start": 3,
        "token_end": 3,
        "token_id": "token-3",
        "match_ids": [],
        "secondary_match_ids": []
      }
    ],
    "edges": [
      {
        "parent_id": "document-0",
        "child_id": "sentence-0",
        "order": 0
      },
      {
        "parent_id": "sentence-0",
        "child_id": "bunsetsu-0-0",
        "order": 0
      },
      {
        "parent_id": "bunsetsu-0-0",
        "child_id": "token-0",
        "order": 0
      },
      {
        "parent_id": "sentence-0",
        "child_id": "bunsetsu-0-1",
        "order": 1
      },
      {
        "parent_id": "bunsetsu-0-1",
        "child_id": "token-1",
        "order": 0
      },
      {